{
  "$schema": "https://json-schema.org/draft/2020-12/schema",
  "$id": "https://blup.dev/schemas/feasibility_result.v1.schema.json",
  "title": "FeasibilityResult",
  "type": "object",
  "version": "1.0.0",
  "required": ["feasible", "reason"],
  "properties": {
    "feasible": {
      "type": "boolean",
      "description": "Whether the goal is feasible to teach"
    },
    "reason": {
      "type": "string",
      "maxLength": 1000,
      "description": "Explanation of the feasibility assessment"
    },
    "suggestions": {
      "type": "array",
      "items": { "type": "string", "maxLength": 500 },
      "maxItems": 5,
      "description": "Suggestions for adjusting an infeasible goal"
    },
    "estimated_duration": {
      "type": "string",
      "maxLength": 200,
      "description": "Estimated learning duration (e.g. '4-6 weeks')"
    },
    "prerequisites": {
      "type": "array",
      "items": { "type": "string", "maxLength": 300 },
      "maxItems": 10,
      "description": "Recommended prerequisites"
    }
  }
}
